{"Id": 0, "BC_description": "By default, passing more command-line arguments than explicitly declared now results in a parsing error. Previously, excess arguments were accepted silently, which could lead to user errors being overlooked, such as unquoted strings with spaces being misinterpreted. This change improves CLI correctness by enforcing strict argument validation. The behavior can be reverted using `.allowExcessArguments(true)` if needed.", "Reference": ["https://github.com/tj/commander.js/pull/2223"], "Changed_object": {"type": "call", "className": ["Command"], "methodName": ["parse", "allowExcessArguments"], "propertyName": [], "moduleName": []}, "Adaptation_method": "Declare expected arguments explicitly using `.argument()` to handle variable input, or re-enable the previous lenient behavior by calling `.allowExcessArguments(true)`. Example:\n\nBefore:\n```js\nprogram.option('-p, --port <number>', 'port number');\nprogram.action((options) => {\n  console.log(program.args);\n});\n```\n\nAfter (recommended):\n```js\nprogram.option('-p, --port <number>', 'port number');\nprogram.argument('[args...]', 'remote command and arguments');\nprogram.action((args, options) => {\n  console.log(args);\n});\n```\n\nOr (for backward compatibility):\n```js\nprogram.option('-p, --port <number>', 'port number');\nprogram.allowExcessArguments(true);\nprogram.action((options) => {\n  console.log(program.args);\n});\n```", "RequireInfoFlag": false, "RequireInfo": ""}