{"Id": 11, "BC_description": "The default value of the 'serialization' option for 'subprocess.send()' is now 'advanced' (previously 'json'). As a result, if you pass objects containing functions or symbols to subprocess.send(), a runtime exception will be thrown instead of silently omitting these properties as before. This affects all code paths where subprocess.send() is called without explicitly specifying 'serialization' as 'json', and the sent object may contain function or symbol properties.", "Reference": ["release_note.md#v9.0.0", "#905"], "Changed_object": {"type": "call", "className": ["subprocess"], "methodName": ["send"], "propertyName": [], "moduleName": []}, "Adaptation_method": "Do not pass objects with functions or symbols to subprocess.send().\n// Before:\nsubprocess.send({example: true, getExample() {}});\n// After:\nsubprocess.send({example: true});\n\nIf you need to send functions or symbols, you must refactor your code so those properties are excluded before sending, or handle them separately. Alternatively, explicitly pass 'serialization: \"json\"' as an option to revert to the old behavior:\nsubprocess.send(obj, {serialization: 'json'});", "RequireInfoFlag": false, "RequireInfo": ""}