{"Id": 0, "BC_description": "Direct internal imports from Redux's internal module paths (e.g., 'redux/lib/createStore') are no longer supported. Starting with Redux v4.0.0, the library now bundles CommonJS and ES module formats into a single entry point (e.g., 'redux.js'), which removes the individual internal files from the published package. This change improves bundle optimization and reduces overhead for end users by eliminating redundant transpilation artifacts and module indirections, but breaks any code relying on private module paths.", "Reference": ["https://github.com/reactjs/redux/compare/v3.7.2...v4.0.0-beta.1", "#2358"], "Changed_object": {"type": "import", "className": [], "methodName": [], "propertyName": [], "moduleName": ["redux/lib/createStore", "redux/lib/combineReducers", "redux/lib/applyMiddleware", "redux/lib/bindActionCreators", "redux/lib/compose", "redux/lib/*"]}, "Adaptation_method": "Replace direct internal imports with named imports from the main Redux entry point. For example:\nBefore: import createStore from 'redux/lib/createStore';\nAfter: import { createStore } from 'redux';", "RequireInfoFlag": false, "RequireInfo": ""}