{"Id": 1, "BC_description": "Queue methods (saturated, unsaturated, empty, drain, error) have been changed to be awaitable. These methods now return promises when called without callbacks and support the previous callback-based behavior when callbacks are provided.", "Reference": ["commit: e04466", "BREAKING CHANGE: awaitable queues (#1641)"], "Changed_object": {"type": "call", "className": ["queue"], "methodName": ["saturated", "unsaturated", "empty", "drain", "error"], "propertyName": [], "moduleName": []}, "Adaptation_method": "Update queue method usage to handle the new awaitable behavior:\n\n1. Previous callback approach (still supported):\n```javascript\nq.drain(function() {\n  console.log('all items have been processed');\n});\n\nq.error(function(err, task) {\n  console.error('task experienced an error');\n});\n```\n\n2. New promise-based approach:\n```javascript\n// Using await\nawait q.drain();\n\n// Or using then/catch\nq.drain().then(() => {\n  console.log('all items have been processed');\n});\n```", "RequireInfoFlag": false, "RequireInfo": ""}