{"Id": 7, "BC_description": "Limits of less than 1 now cause a RangeError to be thrown in all queue and collection methods that accept a limit parameter, such as eachOfLimit, queue, concatLimit, eachLimit, forEachOfLimit, groupByLimit, and mapLimit, potentially breaking code that uses such limits without error handling. This change affects any method that accepts a limit or concurrency parameter, as indicated by the wildcard usage and confirmed by the provided code examples.", "Reference": ["#1249", "#1552"], "Changed_object": {"type": "call", "className": [], "methodName": ["eachOfLimit", "queue", "concatLimit", "eachLimit", "forEachOfLimit", "groupByLimit", "mapLimit", "*"], "propertyName": [], "moduleName": []}, "Adaptation_method": "Ensure that any limit parameter passed to affected methods is at least 1. For example, change `someMethod(limit: 0)` to `someMethod(limit: 1)` or higher. Alternatively, add error handling using try-catch blocks to catch and handle the RangeError, e.g., `try { someMethod(limit: 0) } catch (error) { console.error(error); }`.", "RequireInfoFlag": false, "RequireInfo": ""}