{"Id": 9, "BC_description": "The partial application feature of async.applyEach has been removed. Previously, calling async.applyEach(fns) returned a function that accepted arguments for later partial application, such as runFns(arg1, arg2, cb). Now, async.applyEach only supports an immediate callback or awaiting its result; you can no longer use applyEach to build a partially-applied function that waits for arguments. Code patterns relying on partial application via applyEach will break and must be refactored to provide all arguments directly to the original functions, or by using a wrapper function if needed.", "Reference": ["commit: 667e71", "#1640"], "Changed_object": {"type": "call", "className": ["async"], "methodName": ["applyEach"], "propertyName": [], "moduleName": []}, "Adaptation_method": "Refactor any code using partial application with async.applyEach. For example, replace:\n\n// Before (partial application):\nconst runFns = async.applyEach(fns);\nrunFns(arg1, arg2, cb);\n\n// After (no partial application):\nasync.applyEach(fns, arg1, arg2, cb);\n// Or, for promise usage:\nawait async.applyEach(fns, arg1, arg2);\n\nIf partial application is needed, use a wrapper:\nconst runFns = (a1, a2, cb) => async.applyEach(fns, a1, a2, cb);", "RequireInfoFlag": false, "RequireInfo": ""}