{"Id": 1, "BC_description": "In execa v9.0.0, when the 'encoding' option is set to 'buffer' in both execa() and execaSync(), the output properties result.stdout, result.stderr, and result.all now return a Uint8Array instead of a Buffer. Previously, these properties returned Node.js Buffer instances. This change also removes support for 'encoding: null'. Code relying on Buffer-specific methods or Buffer.isBuffer() will break and needs to adapt to the new return type. If a Buffer instance is necessary, convert the Uint8Array by using Buffer.from(stdout).", "Reference": ["release_note.md#v9.0.0", "#586", "https://sindresorhus.com/blog/goodbye-nodejs-buffer", "https://github.com/sindresorhus/execa/issues/584", "https://github.com/sindresorhus/execa/issues/480", "commit: fix: remove support for `encoding: null`", "commit: feat: migrate to TypedArray", "commit: fix: `execaSync` still returns Buffer value when passing encoding: 'buffer' option"], "Changed_object": {"type": "call", "className": ["execa", "execaSync"], "methodName": ["stdout", "stderr", "all"], "propertyName": [], "moduleName": ["execa"]}, "Adaptation_method": "Before:\nconst {stdout} = await execa('node', ['file.js'], {encoding: 'buffer'});\nconsole.log(Buffer.isBuffer(stdout)); // true\n\nAfter:\nconst {stdout} = await execa('node', ['file.js'], {encoding: 'buffer'});\nconsole.log(stdout instanceof Uint8Array); // true\n// If Buffer is needed:\nconst buffer = Buffer.from(stdout);\n\nNote: The same applies to execaSync(). Also, remove any use of 'encoding: null', as it is no longer supported.", "RequireInfoFlag": false, "RequireInfo": ""}