{"Id": 2, "BC_description": "Several encoding option values have been renamed in the execa library, including: null to 'buffer', 'utf-8' to 'utf8', 'UTF8' to 'utf8', 'utf-16le' to 'utf16le', 'ucs2' to 'utf16le', 'ucs-2' to 'utf16le', and 'binary' to 'latin1'. Additionally, the 'buffer' encoding now returns a Uint8Array instead of a Buffer, and 'encoding: null' has been removed entirely.", "Reference": ["#586", "#928", "#584", "#480"], "Changed_object": {"type": "call", "className": ["execa"], "methodName": ["execa", "execaSync"], "propertyName": ["encoding"], "moduleName": ["execa"]}, "Adaptation_method": "Update all encoding option values according to the new naming conventions and handle the return type change:\n\n```diff\n- await execa('node', ['file.js'], {encoding: null});\n+ await execa('node', ['file.js'], {encoding: 'buffer'});\n\n- await execa('node', ['file.js'], {encoding: 'utf-8'});\n+ await execa('node', ['file.js'], {encoding: 'utf8'});\n\n- await execa('node', ['file.js'], {encoding: 'UTF8'});\n+ await execa('node', ['file.js'], {encoding: 'utf8'});\n\n- await execa('node', ['file.js'], {encoding: 'utf-16le'});\n+ await execa('node', ['file.js'], {encoding: 'utf16le'});\n\n- await execa('node', ['file.js'], {encoding: 'ucs2'});\n+ await execa('node', ['file.js'], {encoding: 'utf16le'});\n\n- await execa('node', ['file.js'], {encoding: 'ucs-2'});\n+ await execa('node', ['file.js'], {encoding: 'utf16le'});\n\n- await execa('node', ['file.js'], {encoding: 'binary'});\n+ await execa('node', ['file.js'], {encoding: 'latin1'});\n```\n\nNote that when using `encoding: 'buffer'`, the result is now a `Uint8Array` instead of a `Buffer`. If you need a `Buffer` specifically, you can convert it:\n\n```javascript\nconst result = await execa('node', ['file.js'], {encoding: 'buffer'});\nconst buffer = Buffer.from(result.stdout);\n```", "RequireInfoFlag": false, "RequireInfo": ""}