{"Id": 3, "BC_description": "The ability to pass a file path string directly to `subprocess.pipeStdout()`, `pipeStderr()`, and `pipeAll()` has been removed. These methods no longer accept string arguments for file redirection. Instead, file output must be configured through the options object using `stdout`, `stderr`, or both with the `{file: './path'}` syntax. This change ensures consistent handling of subprocess output and prevents misuse of the piping interface.", "Reference": ["#752"], "Changed_object": {"type": "call", "className": ["Subprocess"], "methodName": ["pipeStdout", "pipeStderr", "pipeAll"], "propertyName": [], "moduleName": []}, "Adaptation_method": "Instead of passing a file path string directly to `pipeStdout()`, `pipeStderr()`, or `pipeAll()`, configure the output via the options object using the `stdout` and/or `stderr` properties with the `{file: './path'}` format.\n\nBefore:\n```js\nawait execa('node', ['file.js']).pipeStdout('output.txt');\nawait execa('node', ['file.js']).pipeStderr('output.txt');\nawait execa('node', ['file.js']).pipeAll('output.txt');\n```\n\nAfter:\n```js\nawait execa('node', ['file.js'], { stdout: { file: 'output.txt' } });\nawait execa('node', ['file.js'], { stderr: { file: 'output.txt' } });\nawait execa('node', ['file.js'], {\n  stdout: { file: 'output.txt' },\n  stderr: { file: 'output.txt' }\n});\n```", "RequireInfoFlag": false, "RequireInfo": ""}