{"Id": 9, "BC_description": "The 'verbose' option in the execa function has changed from a boolean to a string enum. Previously, passing 'verbose: false' or 'verbose: true' would respectively disable or enable verbose output. Starting from v9.0.0, 'verbose' must be set to either 'none' (equivalent to false) or 'short' (equivalent to true). Update all usages of execa where the 'verbose' option is set as a boolean to use the corresponding string value.", "Reference": ["release_note.md#v9.0.0", "#884"], "Changed_object": {"type": "call", "className": ["execa"], "methodName": ["execa"], "propertyName": ["verbose"], "moduleName": []}, "Adaptation_method": "// Before:\nawait execa('node', ['file.js'], {verbose: false}); // or true\n// After:\nawait execa('node', ['file.js'], {verbose: 'none'}); // or 'short'", "RequireInfoFlag": false, "RequireInfo": ""}