{"Id": 1, "BC_description": "Changed the requirement for input options: previously, either `option.files` or `option.source` was mandatory; now, it must be one of `option.files`, `option.source`, or `option.configure`. This may break clients that relied on the old mandatory behavior without providing one of these options.", "Reference": ["https://github.com/jsdoc2md/jsdoc-api/issues/27"], "Changed_object": {"type": "call", "className": ["*"], "methodName": ["*"], "propertyName": [], "moduleName": []}, "Adaptation_method": "Ensure that in API calls, at least one of `option.files`, `option.source`, or `option.configure` is provided. For example, if previously using `jsdoc2md.render({})` without any option, now add a valid option like `jsdoc2md.render({ files: ['file.js'] })`.", "RequireInfoFlag": false, "RequireInfo": ""}