{"Id": 3, "BC_description": "In version v9.0.0, the methods subprocess.pipeStdout(), subprocess.pipeStderr(), and subprocess.pipeAll() no longer accept a file path or a writable stream directly as their argument. These methods now require you to specify output destinations via the 'stdout' and 'stderr' options in the main execa call. To write to a file, use the option {stdout: {file: './path'}}. To write to a writable stream, use the option {stdout: ['pipe', stream]}. Passing child process objects to these methods is still supported. This change is breaking, as existing code passing a file path or writable stream directly to pipeStdout(), pipeStderr(), or pipeAll() will fail.", "Reference": ["release_note.md#v9.0.0", "#752"], "Changed_object": {"type": "call", "className": ["subprocess"], "methodName": ["pipeStdout", "pipeStderr", "pipeAll"], "propertyName": [], "moduleName": []}, "Adaptation_method": "// Writing stdout or stderr to a file:\n// Before:\nawait execa('node', ['file.js']).pipeStdout('output.txt');\n// After:\nawait execa('node', ['file.js'], {stdout: {file: 'output.txt'}});\n\n// Writing stdout or stderr to a writable stream:\n// Before:\nawait execa('node', ['file.js']).pipeStdout(stream);\n// After:\nawait execa('node', ['file.js'], {stdout: ['pipe', stream]});", "RequireInfoFlag": false, "RequireInfo": ""}