{"Id": 23, "BC_description": "Errors created with Promise.reject() or the reject callback of new Promise() are no longer automatically wrapped as OperationalErrors. In Bluebird 2.x, rejections would be wrapped in an OperationalError with the original error as the 'cause' attribute, but in Bluebird 3.0+ the promise is rejected with the original error object directly.", "Reference": ["docs/docs/new-in-bluebird-3.md"], "Changed_object": {"type": "call", "className": ["Promise"], "methodName": ["reject", "new Promise", "fromCallback"], "propertyName": [], "moduleName": []}, "Adaptation_method": "If your error handling relied on errors from Promise.reject() being wrapped as OperationalErrors, you'll need to either:\n1. Update your error handling to work with non-operational errors directly\n2. Explicitly wrap errors in OperationalError before rejection: `Promise.reject(new OperationalError(err))`\n3. If using Promise.fromCallback with node-style callbacks, you can extract the original error: `.error(e => Promise.reject(e.cause || e))`", "RequireInfoFlag": false, "RequireInfo": ""}