{"Id": 1, "BC_description": "Calling getState, subscribe, or unsubscribe on a Redux store during a dispatch (e.g., within a reducer or middleware that runs during dispatch) now throws a descriptive error. Previously, these calls were allowed but could result in inconsistent state or unpredictable behavior. This change enforces better practices by preventing store introspection or subscription changes while the state is being updated. The error messages now clearly indicate that these operations must not occur during reducer execution and guide users to alternative approaches, such as accessing state from reducer arguments or moving subscription logic to components with callbacks.", "Reference": ["https://github.com/reactjs/redux/compare/v3.7.2...v4.0.0-beta.1", "#1569"], "Changed_object": {"type": "call", "className": ["Store"], "methodName": ["getState", "subscribe", "unsubscribe"], "propertyName": [], "moduleName": []}, "Adaptation_method": "Ensure that store.getState(), store.subscribe(), or store.unsubscribe() are not called during a dispatch cycle, such as inside a reducer or middleware. Move such calls to safe execution contexts. For example:\n\nBefore:\nfunction reducer(state, action) {\n  if (action.type === 'SOME_ACTION') {\n    const currentState = store.getState(); // Throws error\n  }\n  return state;\n}\n\nAfter:\n// Use the state passed as an argument to the reducer\nfunction reducer(state, action) {\n  if (action.type === 'SOME_ACTION') {\n    // Use `state` directly instead of calling getState()\n    console.log(state);\n  }\n  return state;\n}\n\n// For subscriptions, register listeners outside reducers, e.g., in components:\ncomponentDidMount() {\n  this.unsubscribe = store.subscribe(() => {\n    console.log(store.getState()); // Safe to call in callback\n  });\n}\n\ncomponentWillUnmount() {\n  // Unsubscribe outside of dispatch context\n  if (this.unsubscribe) this.unsubscribe();\n}", "RequireInfoFlag": false, "RequireInfo": ""}