{"Id": 0, "BC_description": "The partial application feature of `async.applyEach` has been removed. Previously, you could create a partially applied function by calling `async.applyEach([fn1, fn2])` without arguments, and then later call it with arguments. Now you must provide all arguments in a single call, followed by an additional function call for the callback.", "Reference": ["commit: 667e71", "BREAKING CHANGE: remove partial application feature of applyEach (#1640)"], "Changed_object": {"type": "call", "className": ["async"], "methodName": ["applyEach", "applyEachSeries"], "propertyName": [], "moduleName": []}, "Adaptation_method": "Instead of using partial application with `async.applyEach([fn1, fn2])(arg, callback)`, you now need to explicitly provide all arguments in the function call and add an extra pair of parentheses: `async.applyEach([fn1, fn2], arg)(callback)`. Similarly for `applyEachSeries`.", "RequireInfoFlag": false, "RequireInfo": ""}