{"Id": 5, "BC_description": "Renamed subprocess.pipeStdout(), subprocess.pipeStderr(), and subprocess.pipeAll() to subprocess.pipe(), with a 'from' option to specify 'stdout', 'stderr', or 'all'. This change improves the process piping API and addresses issues #743 and #580.", "Reference": ["#757", "#743", "#580"], "Changed_object": {"type": "call", "className": ["Subprocess"], "methodName": ["pipeStdout", "pipeStderr", "pipeAll"], "propertyName": [], "moduleName": []}, "Adaptation_method": "Use subprocess.pipe() with the command and 'from' option. Example: await execa('node', ['file.js']).pipe('node', ['other.js'], { from: 'stderr' }); // Instead of .pipeStderr(execa('node', ['other.js']))", "RequireInfoFlag": false, "RequireInfo": ""}