{"Id": 9, "BC_description": "The `forceKillAfterTimeout` option has been renamed to `forceKillAfterDelay` and moved from the `subprocess.kill()` method to the top-level options when calling `execa()`. This change affects how delayed force-killing of subprocesses is configured, centralizing it at process creation rather than at termination time. The option is now passed directly to `execa()` and is no longer accepted in the `kill()` method's options.", "Reference": ["#714", "#723"], "Changed_object": {"type": "call", "className": ["Subprocess"], "methodName": ["kill"], "propertyName": ["forceKillAfterTimeout"], "moduleName": ["execa"]}, "Adaptation_method": "Move the `forceKillAfterDelay` option to the `execa()` call and remove it from `subprocess.kill()`.\n\nBefore:\n```js\nconst subprocess = execa('node', ['file.js']);\nsubprocess.kill('SIGTERM', { forceKillAfterTimeout: 1000 });\n```\n\nAfter:\n```js\nconst subprocess = execa('node', ['file.js'], { forceKillAfterDelay: 1000 });\nsubprocess.kill('SIGTERM');\n```", "RequireInfoFlag": false, "RequireInfo": ""}